### ISSUE TITLE
mg_check_ip_acl not working

### ISSUE THREAD

**Issue by jcorporation** [cesanta/mongoose#1452]
- My goal is: use mg_check_ip_acl
- My actions were: tested this feature with example code
- My expectation was: mg_check_ip_acl works as documented
- The result I saw: mg_check_ip_acl does not match correctly ip against acl
- My question is: please fix this bug

# Environment

- mongoose version: current master (also tested with latest release code)
- Compiler/IDE and SDK: gcc linux 
- Target hardware/board: x86 (64bit)
- Connectivity chip/module: n/a

I used the `examples/http-server/main.c` file and added code from the documentation to the event handler:
```
if (ev == MG_EV_ACCEPT) {
    if (mg_check_ip_acl(mg_str("-0.0.0.0/0,+127.0.0.1"), c->peer.ip) != 1) {
      LOG(LL_INFO, ("NOT ALLOWED!"));
    }
    else {
      LOG(LL_INFO, ("ALLOWED!"));
    }
}
```

Connecting from localhost (with ip):
```
telnet 127.0.0.1 8000
```
```
2022-01-19 18:34:49 2 main.c:103:main            Mongoose version : v7.5
2022-01-19 18:34:49 2 main.c:104:main            Listening on     : http://localhost:8000
2022-01-19 18:34:49 2 main.c:105:main            Web root         : [/tmp/mongoose/examples/http-server]
2022-01-19 18:34:52 2 main.c:24:cb               NOT ALLOWED!
^C2022-01-19 18:34:57 2 net.c:147:mg_mgr_free      All connections closed
2022-01-19 18:34:57 2 main.c:108:main            Exiting on signal 2
```
I validated with tcpdump that connection source is really 127.0.0.1.
```
tcpdump -i lo -nn
tcpdump: verbose output suppressed, use -v[v]... for full protocol decode
listening on lo, link-type EN10MB (Ethernet), snapshot length 262144 bytes
19:40:45.490472 IP 127.0.0.1.42150 > 127.0.0.1.8000: Flags [S], seq 3478132289, win 65495, options [mss 65495,sackOK,TS val 1145207588 ecr 0,nop,wscale 7], length 0
19:40:45.490564 IP 127.0.0.1.8000 > 127.0.0.1.42150: Flags [S.], seq 3382216518, ack 3478132290, win 65483, options [mss 65495,sackOK,TS val 1145207588 ecr 1145207588,nop,wscale 7], length 0
19:40:45.490597 IP 127.0.0.1.42150 > 127.0.0.1.8000: Flags [.], ack 1, win 512, options [nop,nop,TS val 1145207588 ecr 1145207588], length 0
```

**Comment by cpq** [comment]
Pushed https://github.com/cesanta/mongoose/commit/59c4dfa33b9f6aa6012ec6e958840de467afde08
