### ISSUE TITLE
(built-in ip stack) Clients supporting ECN can not connect

### ISSUE THREAD

**Issue by washley** [cesanta/mongoose#3402]
I was debugging why my attempts to connect to a tcp socket (this is with the built-in ip stack) were being responded to with connection refused. It turns out that [this part of `rx_tcp`](https://github.com/cesanta/mongoose/blob/7ffc51d38e2c54c3eaadedbf85547879e42f32f8/src/net_builtin.c#L1517) was being hit. Further digging found that my SYN packet's flags field was not just `0x2` which is required [in this earlier part of `rx_tcp`](https://github.com/cesanta/mongoose/blob/7ffc51d38e2c54c3eaadedbf85547879e42f32f8/src/net_builtin.c#L1483), but `0xc2`. Those extra set bits are part of [Explicit Congestion Notification](https://en.wikipedia.org/wiki/Explicit_Congestion_Notification), a tcp feature requested in the SYN and then either confirmed via the SYN+ACK, or just ignored if the server doesn't support it.

The issue is that mongoose is being overly selective in its flags handling and therefore connection attempts from clients advertising support for ECN are broken.

Here's what my refused connection attempts look like:
```
14:01:55.796051 IP (tos 0x0, ttl 64, id 0, offset 0, flags [none], proto TCP (6), length 64)
    10.10.10.159.60939 > 10.10.20.176.80: Flags [SEW], cksum 0x2a10 (correct), seq 2398394374, win 65535, options [mss 1460,nop,wscale 6,nop,nop,TS val 3476485179 ecr 0,sackOK,eol], length 0
14:01:55.831737 IP (tos 0x0, ttl 63, id 0, offset 0, flags [DF], proto TCP (6), length 40)
    10.10.20.176.80 > 10.10.10.159.60939: Flags [R.], cksum 0x4fa6 (correct), seq 0, ack 2398394375, win 6000, length 0
```
Note the `[SEW]` flags (`SYN` + `ECE` + `CWR`).

On MacOS, ECE can be disabled on outbound connections with the command `sudo sysctl -w net.inet.tcp.ecn_initiate_out=0`, which then allows me to connect:
```
13:52:30.729285 IP (tos 0x10, ttl 64, id 0, offset 0, flags [none], proto TCP (6), length 64)
    10.10.10.159.50922 > 10.10.20.176.42000: Flags [S], cksum 0x64b5 (correct), seq 4185496838, win 65535, options [mss 1460,nop,wscale 6,nop,nop,TS val 4241858706 ecr 0,sackOK,eol], length 0
13:52:30.782159 IP (tos 0x0, ttl 63, id 0, offset 0, flags [DF], proto TCP (6), length 44)
    10.10.20.176.42000 > 10.10.10.159.50922: Flags [S.], cksum 0x84dc (correct), seq 50922, ack 4185496839, win 6000, options [mss 1460], length 0
```

Another way I am able to get connections working without, modifying my OS settings, is by clearing out the ECE and CWR flags at the start of the `rx_tcp` function so they do not interfere.

**Comment by scaprile** [comment]
Thank you.
We do not claim to fully support RFCs, we do not support ECN, and none of our paying customers requested that, so far.
If you have a compelling application that needs that, please contact us at Support. Thank you

**Comment by washley** [comment]
Do keep in mind that this is enabled by default in MacOS and presumably iOS (or will be enabled there soon), so that's a lot of clients that will probably start being affected.
