### ISSUE TITLE
Sended TCP/WS packet(s) deleted without awaiting of any ACK .

### ISSUE THREAD

**Issue by Pe3ucTop** [cesanta/mongoose#3507]
I'm noticed issue with WebSocket, but probably related to whole TCP, details :
Mongoose 7.21
HW: STM32G4 +  W5500  
MG_ARCH						MG_ARCH_CMSIS_RTOS2
MG_ENABLE_TCPIP				1
MG_ENABLE_DRIVER_W5500		1
Device implement HTTP/WS server
When sending continues data stream over WS  and media is slow (passed over GSM/LTE), some paket(s) got lost, but library continue to send next packets, even client send repeated old TCP sequence AND and awaiting resend of missing packets.
I could not find any functions for ACK check in Mongoose library, and looks like it just send next packets and whenever packet sent, delete it from buffers without awaiting ACK .
No any ERROR reported in this situation from library. 
Also noticed later after (or possibly) when connection closed, I see packet with needed sequence but empty one, probably by TCP it return last good seq...

It's look like related to #1876 discussion .

Here will be Wireshark  moment where sequence got lost and wireshark show it:
```
6493	8056.103723712			100.121.3.98	172.17.0.1	TCP	40	39912 → 21080 [ACK] Seq=5176 Ack=1876295 Win=65535 Len=0
6494	8056.190585946			100.121.3.98	172.17.0.1	WebSocket	77	WebSocket Binary [FIN] [MASKED]
6495	8056.263336653			172.17.0.1	100.121.3.98	WebSocket	136	WebSocket Binary [FIN] 
6496	8056.263525011			100.121.3.98	172.17.0.1	TCP	40	39912 → 21080 [ACK] Seq=5213 Ack=1876391 Win=65535 Len=0
6497	8056.327533065			172.17.0.1	100.121.3.98	TCP	1280	21080 → 39912 [PSH, ACK] Seq=1876391 Ack=5213 Win=6000 Len=1240 [TCP segment of a reassembled PDU]
6498	8056.328834129			100.121.3.98	172.17.0.1	TCP	40	39912 → 21080 [ACK] Seq=5213 Ack=1877631 Win=65535 Len=0
6499	8056.331646598			172.17.0.1	100.121.3.98	WebSocket	977	WebSocket Binary [FIN] 
6500	8056.337039640			100.121.3.98	172.17.0.1	TCP	40	39912 → 21080 [ACK] Seq=5213 Ack=1878568 Win=65535 Len=0
6501	8056.536212254			172.17.0.1	100.121.3.98	TCP	1280	21080 → 39912 [PSH, ACK] Seq=1878568 Ack=5213 Win=6000 Len=1240 [TCP segment of a reassembled PDU]
6502	8056.536236648			172.17.0.1	100.121.3.98	WebSocket	977	WebSocket Binary [FIN] 
6503	8056.536273916			100.121.3.98	172.17.0.1	TCP	40	39912 → 21080 [ACK] Seq=5213 Ack=1880745 Win=65535 Len=0
6504	8056.562037848			172.17.0.1	100.121.3.98	WebSocket	977	[TCP Previous segment not captured] WebSocket Continuation[FRAGMENT]  
6505	8056.562067128			100.121.3.98	172.17.0.1	TCP	40	[TCP Dup ACK 6503#1] 39912 → 21080 [ACK] Seq=5213 Ack=1880745 Win=65535 Len=0
6506	8056.684193488			172.17.0.1	100.121.3.98	WebSocket	1280	WebSocket Continuation[FRAGMENT]  WebSocket Connection Close [FIN] [MASKED]
6507	8056.684219982			100.121.3.98	172.17.0.1	TCP	40	[TCP Dup ACK 6503#2] 39912 → 21080 [ACK] Seq=5213 Ack=1880745 Win=65535 Len=0
6508	8056.686628075			172.17.0.1	100.121.3.98	WebSocket	977	WebSocket Unknown Opcode [FIN] [MASKED]WebSocket Continuation[FRAGMENT]  
6509	8056.686740025			100.121.3.98	172.17.0.1	TCP	40	[TCP Dup ACK 6503#3] 39912 → 21080 [ACK] Seq=5213 Ack=1880745 Win=65535 Len=0
6510	8056.746155226			172.17.0.1	100.121.3.98	WebSocket	1280	WebSocket Binary [FIN] WebSocket Unknown Opcode [FIN] [MASKED]
6511	8056.746182683			100.121.3.98	172.17.0.1	TCP	40	[TCP Dup ACK 6503#4] 39912 → 21080 [ACK] Seq=5213 Ack=1880745 Win=65535 Len=0
6512	8056.746190985			172.17.0.1	100.121.3.98	WebSocket	977	WebSocket Unknown Opcode [FIN] [MASKED]WebSocket Pong[FRAGMENT]  
6513	8056.746212778			100.121.3.98	172.17.0.1	TCP	40	[TCP Dup ACK 6503#5] 39912 → 21080 [ACK] Seq=5213 Ack=1880745 Win=65535 Len=0
6514	8056.794609156			172.17.0.1	100.121.3.98	WebSocket	1280	WebSocket Unknown Opcode[FRAGMENT]  WebSocket Unknown Opcode [FIN] [MASKED]
```

**Comment by scaprile** [comment]
It is very hard for me to understand what you're trying to send.
If it is what I think you're trying to describe, we currently do not honor peer receive window. The feature request you link is ages old and unrelated, this is our current TCP send window implementation; we do not handle lost segments.

**Comment by Maksons** [comment]
Sorry, it's hard to believe that this library do not implement critical key points of the TCP standard.

> [2.2. ](https://www.rfc-editor.org/rfc/rfc9293.html#section-2.2)[Key TCP Concepts](https://www.rfc-editor.org/rfc/rfc9293.html#name-key-tcp-concepts)
>TCP provides a reliable, in-order, byte-stream service to applications.
>
>The application byte-stream is conveyed over the network via TCP segments, with each TCP segment sent as an Internet Protocol (IP) datagram.
>
>TCP reliability consists of detecting packet losses (via sequence numbers) and errors (via per-segment checksums), as well as correction via retransmission.


I wonder why this issue got closed so fast, like hiding/conceal critical non-compliance . 
And answer do not show that this is mentioned somewhere even.
TCP not reliable in the library, nor any other protocols on top of it (like WS in my case).
I understand that this need resources (extra RAM) in device, but there is no other choice !

**Comment by scaprile** [comment]
"Critical" is a subjective concept that may or may not apply to the scenario in which you or our customers use our library.
Our focus is not in stuff that may happen in rare situations that none of our paying customers use.
The issue has been closed because we are aware of this, it is so by design, we do know how TCP works, and we don't plan to change it at this time.

Said that, if this is very important to you, just contact us at Support and we can happily discuss how to move forward and start a productive business relationship.
Thank you.
