### ISSUE TITLE
how to close websocket elegantly

### ISSUE THREAD

**Issue by chia144** [cesanta/mongoose#3344]
- My goal is: _close websocket， two and only two "WebSocket Connection Close [FIN]" frames and the TCP four-way handshake were captured from Wireshark_
- My actions were:

server was mongoose-7.20\tutorials\websocket\websocket-server\main.c

client was edited from mongoose-7.20\tutorials\websocket\websocket-client\main.c 
```
  } else if (ev == MG_EV_WS_MSG) {
    // When we get echo response, print it
    struct mg_ws_message *wm = (struct mg_ws_message *) ev_data;
    printf("GOT ECHO REPLY: [%.*s]\n", (int) wm->data.len, wm->data.buf);
    mg_ws_send(c, "", 0, WEBSOCKET_OP_CLOSE);
    //c->is_draining = 1;
  }

  if (ev == MG_EV_ERROR || ev == MG_EV_CLOSE/* || ev == MG_EV_WS_MSG*/) {
    *(bool *) c->fn_data = true;  // Signal that we're done
    if (c->is_tls) {
      mg_free(s_ca.buf);
      s_ca.buf = NULL;
    }
  }
```

I call `mg_ws_send(c, "", 0, WEBSOCKET_OP_CLOSE);` and remove 2nd （ev == MG_EV_WS_MSG）

- My expectation was: _I captured three "WebSocket Connection Close [FIN]" frames._
- The result I saw: 
```
No.	Time	Source	Destination	Protocol	Length	Info
805	2025-11-20 14:38:39.935	127.0.0.1	127.0.0.1	TCP	56	56171 → 8000 [SYN] Seq=0 Win=65535 Len=0 MSS=65495 WS=256 SACK_PERM
806	2025-11-20 14:38:39.935	127.0.0.1	127.0.0.1	TCP	56	8000 → 56171 [SYN, ACK] Seq=0 Ack=1 Win=65535 Len=0 MSS=65495 WS=256 SACK_PERM
807	2025-11-20 14:38:39.935	127.0.0.1	127.0.0.1	TCP	44	56171 → 8000 [ACK] Seq=1 Ack=1 Win=2619648 Len=0
808	2025-11-20 14:38:39.938	127.0.0.1	127.0.0.1	HTTP	201	GET /websocket HTTP/1.1 
809	2025-11-20 14:38:39.938	127.0.0.1	127.0.0.1	TCP	44	8000 → 56171 [ACK] Seq=1 Ack=158 Win=2619648 Len=0
810	2025-11-20 14:38:39.940	127.0.0.1	127.0.0.1	HTTP	173	HTTP/1.1 101 Switching Protocols 
811	2025-11-20 14:38:39.940	127.0.0.1	127.0.0.1	TCP	44	56171 → 8000 [ACK] Seq=158 Ack=130 Win=2619648 Len=0
812	2025-11-20 14:38:40.006	127.0.0.1	127.0.0.1	WebSocket	55	WebSocket Text [FIN] [MASKED]
813	2025-11-20 14:38:40.006	127.0.0.1	127.0.0.1	TCP	44	8000 → 56171 [ACK] Seq=130 Ack=169 Win=2619648 Len=0
814	2025-11-20 14:38:40.008	127.0.0.1	127.0.0.1	WebSocket	51	WebSocket Text [FIN] 
815	2025-11-20 14:38:40.008	127.0.0.1	127.0.0.1	TCP	44	56171 → 8000 [ACK] Seq=169 Ack=137 Win=2619648 Len=0
816	2025-11-20 14:38:40.029	127.0.0.1	127.0.0.1	WebSocket	50	WebSocket Connection Close [FIN] [MASKED]
817	2025-11-20 14:38:40.029	127.0.0.1	127.0.0.1	TCP	44	8000 → 56171 [ACK] Seq=137 Ack=175 Win=2619648 Len=0
818	2025-11-20 14:38:40.032	127.0.0.1	127.0.0.1	WebSocket	46	WebSocket Connection Close [FIN] 
819	2025-11-20 14:38:40.032	127.0.0.1	127.0.0.1	TCP	44	56171 → 8000 [ACK] Seq=175 Ack=139 Win=2619648 Len=0
820	2025-11-20 14:38:40.034	127.0.0.1	127.0.0.1	TCP	44	8000 → 56171 [FIN, ACK] Seq=139 Ack=175 Win=2619648 Len=0
821	2025-11-20 14:38:40.034	127.0.0.1	127.0.0.1	TCP	44	56171 → 8000 [ACK] Seq=175 Ack=140 Win=2619648 Len=0
822	2025-11-20 14:38:40.053	127.0.0.1	127.0.0.1	WebSocket	50	WebSocket Connection Close [FIN] [MASKED]
823	2025-11-20 14:38:40.053	127.0.0.1	127.0.0.1	TCP	44	8000 → 56171 [RST, ACK] Seq=140 Ack=181 Win=0 Len=0
```
if i add `c->is_draining = 1;` after i send WEBSOCKET_OP_CLOSE, i saw:
```
No.	Time	Source	Destination	Protocol	Length	Info
1012	2025-11-20 14:51:11.230	127.0.0.1	127.0.0.1	TCP	56	56541 → 8000 [SYN] Seq=0 Win=65535 Len=0 MSS=65495 WS=256 SACK_PERM
1013	2025-11-20 14:51:11.230	127.0.0.1	127.0.0.1	TCP	56	8000 → 56541 [SYN, ACK] Seq=0 Ack=1 Win=65535 Len=0 MSS=65495 WS=256 SACK_PERM
1014	2025-11-20 14:51:11.230	127.0.0.1	127.0.0.1	TCP	44	56541 → 8000 [ACK] Seq=1 Ack=1 Win=2619648 Len=0
1015	2025-11-20 14:51:11.233	127.0.0.1	127.0.0.1	HTTP	201	GET /websocket HTTP/1.1 
1016	2025-11-20 14:51:11.233	127.0.0.1	127.0.0.1	TCP	44	8000 → 56541 [ACK] Seq=1 Ack=158 Win=2619648 Len=0
1017	2025-11-20 14:51:11.235	127.0.0.1	127.0.0.1	HTTP	173	HTTP/1.1 101 Switching Protocols 
1018	2025-11-20 14:51:11.235	127.0.0.1	127.0.0.1	TCP	44	56541 → 8000 [ACK] Seq=158 Ack=130 Win=2619648 Len=0
1019	2025-11-20 14:51:11.317	127.0.0.1	127.0.0.1	WebSocket	55	WebSocket Text [FIN] [MASKED]
1020	2025-11-20 14:51:11.317	127.0.0.1	127.0.0.1	TCP	44	8000 → 56541 [ACK] Seq=130 Ack=169 Win=2619648 Len=0
1021	2025-11-20 14:51:11.319	127.0.0.1	127.0.0.1	WebSocket	51	WebSocket Text [FIN] 
1022	2025-11-20 14:51:11.319	127.0.0.1	127.0.0.1	TCP	44	56541 → 8000 [ACK] Seq=169 Ack=137 Win=2619648 Len=0
1023	2025-11-20 14:51:11.347	127.0.0.1	127.0.0.1	WebSocket	50	WebSocket Connection Close [FIN] [MASKED]
1024	2025-11-20 14:51:11.347	127.0.0.1	127.0.0.1	TCP	44	8000 → 56541 [ACK] Seq=137 Ack=175 Win=2619648 Len=0
1025	2025-11-20 14:51:11.351	127.0.0.1	127.0.0.1	WebSocket	46	WebSocket Connection Close [FIN] 
1026	2025-11-20 14:51:11.351	127.0.0.1	127.0.0.1	TCP	44	56541 → 8000 [ACK] Seq=175 Ack=139 Win=2619648 Len=0
1027	2025-11-20 14:51:11.356	127.0.0.1	127.0.0.1	TCP	44	8000 → 56541 [FIN, ACK] Seq=139 Ack=175 Win=2619648 Len=0
1028	2025-11-20 14:51:11.356	127.0.0.1	127.0.0.1	TCP	44	56541 → 8000 [ACK] Seq=175 Ack=140 Win=2619648 Len=0
1029	2025-11-20 14:51:11.359	127.0.0.1	127.0.0.1	TCP	44	56541 → 8000 [RST, ACK] Seq=175 Ack=140 Win=0 Len=0
```
but TCP four-way handshake was interrupted

- My question is: _how to remove 3rd "WebSocket Connection Close [FIN]" and ensure the normal execution of the TCP four-way handshake._

when i remove `c->is_draining = 1;` from main.c and remove `mg_ws_send(c, m.data.buf, m.data.len, WEBSOCKET_OP_CLOSE);` from mongoose.c line 21132, everything is ok
```
No.	Time	Source	Destination	Protocol	Length	Info
1096	2025-11-20 14:55:53.909	127.0.0.1	127.0.0.1	TCP	56	56721 → 8000 [SYN] Seq=0 Win=65535 Len=0 MSS=65495 WS=256 SACK_PERM
1097	2025-11-20 14:55:53.909	127.0.0.1	127.0.0.1	TCP	56	8000 → 56721 [SYN, ACK] Seq=0 Ack=1 Win=65535 Len=0 MSS=65495 WS=256 SACK_PERM
1098	2025-11-20 14:55:53.909	127.0.0.1	127.0.0.1	TCP	44	56721 → 8000 [ACK] Seq=1 Ack=1 Win=2619648 Len=0
1099	2025-11-20 14:55:53.912	127.0.0.1	127.0.0.1	HTTP	201	GET /websocket HTTP/1.1 
1100	2025-11-20 14:55:53.912	127.0.0.1	127.0.0.1	TCP	44	8000 → 56721 [ACK] Seq=1 Ack=158 Win=2619648 Len=0
1101	2025-11-20 14:55:53.914	127.0.0.1	127.0.0.1	HTTP	173	HTTP/1.1 101 Switching Protocols 
1102	2025-11-20 14:55:53.914	127.0.0.1	127.0.0.1	TCP	44	56721 → 8000 [ACK] Seq=158 Ack=130 Win=2619648 Len=0
1103	2025-11-20 14:55:53.986	127.0.0.1	127.0.0.1	WebSocket	55	WebSocket Text [FIN] [MASKED]
1104	2025-11-20 14:55:53.987	127.0.0.1	127.0.0.1	TCP	44	8000 → 56721 [ACK] Seq=130 Ack=169 Win=2619648 Len=0
1105	2025-11-20 14:55:53.989	127.0.0.1	127.0.0.1	WebSocket	51	WebSocket Text [FIN] 
1106	2025-11-20 14:55:53.989	127.0.0.1	127.0.0.1	TCP	44	56721 → 8000 [ACK] Seq=169 Ack=137 Win=2619648 Len=0
1107	2025-11-20 14:55:54.005	127.0.0.1	127.0.0.1	WebSocket	50	WebSocket Connection Close [FIN] [MASKED]
1108	2025-11-20 14:55:54.005	127.0.0.1	127.0.0.1	TCP	44	8000 → 56721 [ACK] Seq=137 Ack=175 Win=2619648 Len=0
1109	2025-11-20 14:55:54.010	127.0.0.1	127.0.0.1	WebSocket	46	WebSocket Connection Close [FIN] 
1110	2025-11-20 14:55:54.010	127.0.0.1	127.0.0.1	TCP	44	56721 → 8000 [ACK] Seq=175 Ack=139 Win=2619648 Len=0
1111	2025-11-20 14:55:54.012	127.0.0.1	127.0.0.1	TCP	44	8000 → 56721 [FIN, ACK] Seq=139 Ack=175 Win=2619648 Len=0
1112	2025-11-20 14:55:54.013	127.0.0.1	127.0.0.1	TCP	44	56721 → 8000 [ACK] Seq=175 Ack=140 Win=2619648 Len=0
1113	2025-11-20 14:55:54.043	127.0.0.1	127.0.0.1	TCP	44	56721 → 8000 [FIN, ACK] Seq=175 Ack=140 Win=2619648 Len=0
1114	2025-11-20 14:55:54.043	127.0.0.1	127.0.0.1	TCP	44	8000 → 56721 [ACK] Seq=140 Ack=176 Win=2619648 Len=0
```

# Environment

- mongoose version: _7.20_
- Compiler/IDE and SDK: VisualStudio2022 version _17.14_
- Target hardware/board: _N/A_
- Connectivity chip/module: _N/A_
- Target RTOS/OS (if applicable): _N/A_

**Comment by scaprile** [comment]
Please see our [documentation](https://mongoose.ws/documentation/),  and follow the guidelines in our [tutorials](https://mongoose.ws/documentation/#tutorials-and-examples).

https://mongoose.ws/documentation/#opening-and-closing-connections

Please do not edit, use what's provided
The TCP/IP stack you are using is not controlled by us, we can only open or close a socket.

If you still have a problem, we will reopen this issue, make sure you have filled the issue template, and provide us with pertinent information (including useful network capture files; no snapshots, please _attach capture files_) in order to reproduce and fix the issue. We don't inspect your code for errors, please _attach_ the **minimum piece of code** that can reproduce the issue. If you _post_ code, please correctly format it so Github shows it as code.
